{
  "format": "gpp-shape/0.1",
  "key": "drc-d5-unregistered-egress",
  "version": "1.0.0",
  "title": "DRC fixture drc-d5-unregistered-egress",
  "description": "Seeded D-5: an environment binding whose egress names an unregistered tool.",
  "triggers": [
    "claim"
  ],
  "stages": [
    {
      "key": "a",
      "title": "Stage a",
      "accountablePrincipalRef": "role:shape-owner",
      "advance": {
        "kind": "governed-decision",
        "condition": "The accountable owner decides stage a.",
        "decisionScope": "drc-enforced-scope",
        "gate": {
          "authority": "wwmd",
          "mode": "enforced",
          "blocking": true,
          "resolution": "accountable-human"
        }
      },
      "evidence": [
        "decision-record"
      ]
    },
    {
      "key": "bound",
      "title": "Bound stage",
      "accountablePrincipalRef": "role:shape-owner",
      "advance": {
        "kind": "status-change",
        "condition": "Bound work complete."
      },
      "evidence": [
        "manual-check"
      ],
      "binding": {
        "id": "drc-environment-binding",
        "version": 1,
        "enforcement": "environment",
        "egress": [
          "no_such_egress_tool"
        ]
      }
    }
  ],
  "stopConditions": [
    {
      "kind": "success",
      "condition": "Every stage recorded its evidence.",
      "disposition": "proceed"
    },
    {
      "kind": "failure",
      "condition": "A stage cannot produce its evidence.",
      "disposition": "refused"
    },
    {
      "kind": "budget",
      "condition": "The cycle budget is spent.",
      "disposition": "inconclusive"
    }
  ],
  "grants": [],
  "measures": [],
  "budgets": [],
  "reviewPoint": {
    "everyDays": 7,
    "description": "Weekly review."
  },
  "collaborationShape": null
}
