{
  "format": "gpp-shape/0.1",
  "key": "drc-sub-shape-widening",
  "version": "1.0.0",
  "title": "DRC fixture drc-sub-shape-widening",
  "description": "Seeded D-9: the sub-shape declares grants the parent does not hold.",
  "triggers": [
    "claim"
  ],
  "stages": [
    {
      "key": "a",
      "title": "Stage a",
      "accountablePrincipalRef": "role:shape-owner",
      "advance": {
        "kind": "status-change",
        "condition": "Stage a recorded its evidence."
      },
      "evidence": [
        "manual-check"
      ],
      "subShape": "inquiry-response-watch@1.0.0"
    }
  ],
  "stopConditions": [
    {
      "kind": "success",
      "condition": "Every stage recorded its evidence.",
      "disposition": "proceed"
    },
    {
      "kind": "failure",
      "condition": "A stage cannot produce its evidence.",
      "disposition": "refused"
    },
    {
      "kind": "budget",
      "condition": "The cycle budget is spent.",
      "disposition": "inconclusive"
    }
  ],
  "grants": [
    "tool:read",
    "tool:storefront_read",
    "tool:crm_read"
  ],
  "measures": [],
  "budgets": [],
  "reviewPoint": {
    "everyDays": 7,
    "description": "Weekly review."
  },
  "collaborationShape": null
}
