{
  "format": "gpp-shape/0.1",
  "key": "drc-pass-stage-deadline",
  "version": "1.0.0",
  "title": "DRC fixture drc-pass-stage-deadline",
  "description": "A stage deadline: executable since GPP Phase 3c PR-3c-4, so it compiles with no finding.",
  "triggers": [
    "claim"
  ],
  "stages": [
    {
      "key": "a",
      "title": "Stage a",
      "accountablePrincipalRef": "role:shape-owner",
      "advance": {
        "kind": "status-change",
        "condition": "Stage a recorded its evidence."
      },
      "evidence": [
        "manual-check"
      ],
      "deadline": {
        "afterDays": 3,
        "description": "Raise a deadline event after three days."
      }
    }
  ],
  "stopConditions": [
    {
      "kind": "success",
      "condition": "Every stage recorded its evidence.",
      "disposition": "proceed"
    },
    {
      "kind": "failure",
      "condition": "A stage cannot produce its evidence.",
      "disposition": "refused"
    },
    {
      "kind": "budget",
      "condition": "The cycle budget is spent.",
      "disposition": "inconclusive"
    }
  ],
  "grants": [],
  "measures": [],
  "budgets": [],
  "reviewPoint": {
    "everyDays": 7,
    "description": "Weekly review."
  },
  "collaborationShape": null
}
