{
  "format": "gpp-shape/0.1",
  "key": "drc-pass-sub-shape",
  "version": "1.0.0",
  "title": "DRC fixture drc-pass-sub-shape",
  "description": "A stage that calls a registered sub-shape within the parent's grants: implemented in GPP Phase 3c PR-3c-5 and executable since BI-086DC167, so it compiles with no finding.",
  "triggers": [
    "claim"
  ],
  "stages": [
    {
      "key": "a",
      "title": "Stage a",
      "accountablePrincipalRef": "role:shape-owner",
      "advance": {
        "kind": "status-change",
        "condition": "Stage a recorded its evidence."
      },
      "evidence": [
        "manual-check"
      ],
      "subShape": "inquiry-response-watch@1.0.0"
    }
  ],
  "stopConditions": [
    {
      "kind": "success",
      "condition": "Every stage recorded its evidence.",
      "disposition": "proceed"
    },
    {
      "kind": "failure",
      "condition": "A stage cannot produce its evidence.",
      "disposition": "refused"
    },
    {
      "kind": "budget",
      "condition": "The cycle budget is spent.",
      "disposition": "inconclusive"
    }
  ],
  "grants": [
    "tool:read",
    "tool:workroom_evidence_write",
    "tool:storefront_read",
    "tool:crm_read"
  ],
  "measures": [],
  "budgets": [],
  "reviewPoint": {
    "everyDays": 7,
    "description": "Weekly review."
  },
  "collaborationShape": null
}
