{
  "format": "gpp-shape/0.1",
  "key": "drc-pass-rework-edge",
  "version": "1.0.0",
  "title": "DRC fixture drc-pass-rework-edge",
  "description": "Passing since GPP Phase 3c PR-3c-3 (rework edges are executable): a bounded rework edge back to an earlier stage.",
  "triggers": [
    "claim"
  ],
  "stages": [
    {
      "key": "a",
      "title": "Stage a",
      "accountablePrincipalRef": "role:shape-owner",
      "advance": {
        "kind": "status-change",
        "condition": "Stage a recorded its evidence."
      },
      "evidence": [
        "manual-check"
      ]
    },
    {
      "key": "b",
      "title": "Stage b",
      "accountablePrincipalRef": "role:shape-owner",
      "advance": {
        "kind": "status-change",
        "condition": "Stage b recorded its evidence."
      },
      "evidence": [
        "manual-check"
      ]
    }
  ],
  "flow": {
    "nodes": [],
    "edges": [
      {
        "from": "a",
        "to": "b"
      },
      {
        "from": "b",
        "to": "success"
      },
      {
        "from": "b",
        "to": "a",
        "rework": {
          "maxIterations": 2
        }
      }
    ]
  },
  "stopConditions": [
    {
      "kind": "success",
      "condition": "Every stage recorded its evidence.",
      "disposition": "proceed"
    },
    {
      "kind": "failure",
      "condition": "A stage cannot produce its evidence.",
      "disposition": "refused"
    },
    {
      "kind": "budget",
      "condition": "The cycle budget is spent.",
      "disposition": "inconclusive"
    }
  ],
  "grants": [],
  "measures": [],
  "budgets": [],
  "reviewPoint": {
    "everyDays": 7,
    "description": "Weekly review."
  },
  "collaborationShape": null
}
