{
  "format": "gpp-shape/0.1",
  "key": "drc-w-orphan-layout",
  "version": "1.0.0",
  "title": "DRC fixture drc-w-orphan-layout",
  "description": "Seeded W-ORPHAN-LAYOUT (warning): the layout sidecar places a node no element has.",
  "triggers": [
    "claim"
  ],
  "stages": [
    {
      "key": "a",
      "title": "Stage a",
      "accountablePrincipalRef": "role:shape-owner",
      "advance": {
        "kind": "status-change",
        "condition": "Stage a recorded its evidence."
      },
      "evidence": [
        "manual-check"
      ]
    }
  ],
  "stopConditions": [
    {
      "kind": "success",
      "condition": "Every stage recorded its evidence.",
      "disposition": "proceed"
    },
    {
      "kind": "failure",
      "condition": "A stage cannot produce its evidence.",
      "disposition": "refused"
    },
    {
      "kind": "budget",
      "condition": "The cycle budget is spent.",
      "disposition": "inconclusive"
    }
  ],
  "grants": [],
  "measures": [],
  "budgets": [],
  "reviewPoint": {
    "everyDays": 7,
    "description": "Weekly review."
  },
  "collaborationShape": null
}
