{
  "format": "gpp-shape/0.1",
  "key": "drc-d4-no-decision-record",
  "version": "1.0.0",
  "title": "DRC fixture drc-d4-no-decision-record",
  "description": "Seeded D-4: a governed stage that declares no decision-record evidence.",
  "triggers": [
    "claim"
  ],
  "stages": [
    {
      "key": "a",
      "title": "Stage a",
      "accountablePrincipalRef": "role:shape-owner",
      "advance": {
        "kind": "governed-decision",
        "condition": "The accountable owner decides stage a.",
        "decisionScope": "drc-untyped-scope"
      },
      "evidence": [
        "manual-check"
      ]
    }
  ],
  "stopConditions": [
    {
      "kind": "success",
      "condition": "Every stage recorded its evidence.",
      "disposition": "proceed"
    },
    {
      "kind": "failure",
      "condition": "A stage cannot produce its evidence.",
      "disposition": "refused"
    },
    {
      "kind": "budget",
      "condition": "The cycle budget is spent.",
      "disposition": "inconclusive"
    }
  ],
  "grants": [],
  "measures": [],
  "budgets": [],
  "reviewPoint": {
    "everyDays": 7,
    "description": "Weekly review."
  },
  "collaborationShape": null
}
